------------------------------------------------------------------
-------------------------- PREPARATION ---------------------------
------------------------------------------------------------------
--
CREATE TABLE my_table(x int, y int, z real);
CREATE TABLE update_events(event_time TIMESTAMPTZ NOT NULL);
--
-- we need this while creating new trigger functions
-- it skips the function validation step.
-- We do not have any information about the incoming tuples at
-- this time, so we can not generate F# code.
-- We have to enable it again at the end of this test
--
SET check_function_bodies = false;
--
DEALLOCATE ALL;
--
PREPARE insert_my_values(int) AS INSERT INTO my_table
    SELECT
        generate_series(1, $1 * 3, 3) AS x,
        generate_series(2, $1 * 3, 3) AS y,
        generate_series(3, $1 * 3, 3) AS z;
--
PREPARE verify_entries(int, int, int, int) AS
    WITH generated_values AS (
        SELECT
            generate_series(1, $1 * 3, 3) + $2 AS x,
            generate_series(2, $1 * 3, 3) + $3 AS y,
            generate_series(3, $1 * 3, 3) + $4 AS z
    )
    SELECT $1 = COUNT(*)
    FROM generated_values AS gv
    RIGHT JOIN my_table AS mt
    ON
        mt.x = gv.x AND
        mt.y = gv.y AND
        mt.z = gv.z;
--
\set entries_quantity 5
\set offset_x 0
\set offset_y 0
\set offset_z 0
--
-------------------------- PREPARATION ---------------------------
------------------------------------------------------------------
--
------------------------------------------------------------------
--------------------------- BEFORE INSERT ------------------------
--
-- create dummy trigger function
-- it always return null
-- so PG must save the new tuple in the database
--
CREATE OR REPLACE FUNCTION returnNullBeforeInsertMyTableFSharp() RETURNS TRIGGER AS $$
None
$$ LANGUAGE plfsharp;
--
-- create the current trigger that calls
-- the dummy function above
-- before any insert
--
CREATE TRIGGER returnNullBeforeInsertMyTable
BEFORE INSERT ON my_table
FOR EACH ROW EXECUTE PROCEDURE returnNullBeforeInsertMyTableFSharp();
--
-- test valid insertion
--
EXECUTE insert_my_values(:entries_quantity);
--
-- verify if the 5 entries are present in the database
--
EXECUTE verify_entries(:entries_quantity, :offset_x, :offset_y, :offset_z);
 ?column? 
----------
 t
(1 row)

--
-- truncate the table
--
TRUNCATE TABLE my_table;
--
\set entries_quantity 10
--
-- test valid insertion
--
EXECUTE insert_my_values(:entries_quantity);
--
-- verify if the 10 entries are present in the database
--
EXECUTE verify_entries(:entries_quantity, :offset_x, :offset_y, :offset_z);
 ?column? 
----------
 t
(1 row)

--
-- remove the previous trigger
--
DROP TRIGGER returnNullBeforeInsertMyTable ON my_table;
--
--------------------------- BEFORE INSERT ------------------------
------------------------------------------------------------------
--
------------------------------------------------------------------
--------------------------- AVOID INSERT -------------------------
--
-- truncate the table
--
TRUNCATE TABLE my_table;
--
\set entries_quantity 5
--
-- test valid insertion
--
EXECUTE insert_my_values(:entries_quantity);
--
-- create another dummy trigger function
-- this one, always return "SKIP", so PG must
-- discard the new tuple (do not save in DB)
--
CREATE OR REPLACE FUNCTION returnSkipBeforeInsertMyTableFSharp() RETURNS TRIGGER AS $$
Some "SKIP"
$$ LANGUAGE plfsharp;
--
-- create a new trigger to call the
-- before_insert_on_my_table_skip for each row
-- before any insert
--
CREATE TRIGGER returnSkipBeforeInsertMyTable
BEFORE INSERT ON my_table
FOR EACH ROW EXECUTE PROCEDURE returnSkipBeforeInsertMyTableFSharp();
--
-- try to insert more data into my_values table
EXECUTE insert_my_values(:entries_quantity);
--
-- try to insert even more data into my_values table
EXECUTE insert_my_values(:entries_quantity);
--
-- verify if the table still contains only data inserted
-- before the trigger function.
-- the function above should avoid any insertion
-- so we do not expect new entries
--
EXECUTE verify_entries(:entries_quantity, :offset_x, :offset_y, :offset_z);
 ?column? 
----------
 t
(1 row)

--
-- remove the previous trigger
--
DROP TRIGGER returnSkipBeforeInsertMyTable ON my_table;
--
--------------------------- AVOID INSERT -------------------------
------------------------------------------------------------------
--
------------------------------------------------------------------
---------------------- MODIFY BEFORE INSERT ----------------------
--
-- create a new trigger function to modify the content
-- inside the new tuple and return "MODIFY", so PG must
-- update the tuple and save it.
--
CREATE OR REPLACE FUNCTION returnModifyBeforeInsertMyTableFSharp() RETURNS TRIGGER AS $$
match TD.tg_tuples.NEW with
| None -> None
| Some _NEW ->
    let ox = (_NEW :> IDataRecord).GetOrdinal("x")
    let oy = (_NEW :> IDataRecord).GetOrdinal("y")
    let oz = (_NEW :> IDataRecord).GetOrdinal("z")
    let x =  (_NEW :> IDataRecord).GetInt32(ox) + 101
    let y =  (_NEW :> IDataRecord).GetInt32(oy) + 102
    let z =  (_NEW :> IDataRecord).GetFloat(oz) + 103.0f
    _NEW.SetInt32 ox x
    _NEW.SetInt32 oy y
    _NEW.SetFloat oz z
    Some "MODIFY"
$$ LANGUAGE plfsharp;
--
-- create a new trigger to call the
-- before_insert_on_my_table_modify for each row
-- before any insert
--
CREATE TRIGGER returnModifyBeforeInsertMyTable
BEFORE INSERT ON my_table
FOR EACH ROW EXECUTE PROCEDURE returnModifyBeforeInsertMyTableFSharp();
--
-- truncate the table
--
TRUNCATE TABLE my_table;
--
\set entries_quantity 5
\set offset_x 101
\set offset_y 102
\set offset_z 103
--
-- insert the data again
--
EXECUTE insert_my_values(:entries_quantity);
--
-- now we must validate the modified tuple
--
EXECUTE verify_entries(:entries_quantity, :offset_x, :offset_y, :offset_z);
 ?column? 
----------
 t
(1 row)

--
-- remove the previous trigger
--
DROP TRIGGER returnModifyBeforeInsertMyTable ON my_table;
--
---------------------- MODIFY BEFORE INSERT ----------------------
------------------------------------------------------------------
--
------------------------------------------------------------------
-------------------- VALIDATE BEFORE INSERT ----------------------
--
-- create a new function to be called before INSERT
-- It shows how to dynamically avoid an insertion based
-- on some validation step
--
CREATE OR REPLACE FUNCTION validateBeforeInsertMyTableFSharp() RETURNS TRIGGER AS $$
match TD.tg_tuples.NEW with
| None -> None
| Some _NEW ->
    match  (_NEW :> IDataRecord).GetInt32((_NEW :> IDataRecord).GetOrdinal("x")) with
    | 1 -> Some "SKIP"
    | _ -> None
$$ LANGUAGE plfsharp;
--
CREATE TRIGGER validateBeforeInsertMyTable
BEFORE INSERT ON my_table
FOR EACH ROW EXECUTE PROCEDURE validateBeforeInsertMyTableFSharp();
--
-- truncate the table again
--
TRUNCATE TABLE my_table;
--
-- try to insert an invalid tuples with NEW.x == 1
--
INSERT INTO my_table (x, y, z) VALUES (1, 2, 3), (1, 3, 2);
--
-- my_table must be empty now
--
SELECT 0 = COUNT(*) FROM my_table;
 ?column? 
----------
 t
(1 row)

--
-- try to insert 2 valid tuples and 1 invalid
--
INSERT INTO my_table VALUES (1, 2, 3), (2, 3, 1), (3, 1, 2);
--
-- my table must have two rows
--
SELECT 2 = COUNT(*) FROM my_table;
 ?column? 
----------
 t
(1 row)

SELECT 1 = COUNT(*) FROM my_table AS mt WHERE mt.x = 2 AND mt.y = 3 AND mt.z = 1;
 ?column? 
----------
 t
(1 row)

SELECT 1 = COUNT(*) FROM my_table AS mt WHERE mt.x = 3 AND mt.y = 1 AND mt.z = 2;
 ?column? 
----------
 t
(1 row)

--
-- remove the previous trigger
--
DROP TRIGGER validateBeforeInsertMyTable ON my_table;
--
-------------------- VALIDATE BEFORE INSERT ----------------------
------------------------------------------------------------------
--
------------------------------------------------------------------
-------------------- VALIDATE BEFORE UPDATE ----------------------
--
-- create a new function to be called before UPDATE
-- It shows how to dynamically avoid an insertion based
-- on the value inside a tuple
--
CREATE OR REPLACE FUNCTION validateBeforeUpdateMyTableFSharp() RETURNS TRIGGER AS $$
match TD.tg_tuples.NEW with
| None -> None
| Some _NEW ->
    match  (_NEW :> IDataRecord).GetInt32((_NEW :> IDataRecord).GetOrdinal("x")) with
    | 1 -> Some "SKIP"
    | _ -> None
$$ LANGUAGE plfsharp;
--
CREATE TRIGGER validateBeforeUpdateMyTable
BEFORE UPDATE ON my_table
FOR EACH ROW EXECUTE PROCEDURE validateBeforeUpdateMyTableFSharp();
--
-- truncate both tables
--
TRUNCATE TABLE my_table;
TRUNCATE TABLE update_events;
--
\set entries_quantity 5
--
-- insert the data again
--
EXECUTE insert_my_values(:entries_quantity);
--
-- update x in the first row with allowed value(x == 2)
--
UPDATE my_table SET x = 2 WHERE x = 1;
--
-- we should have the first row with the following tuple:
-- (2, 2, 3)
--
SELECT 1 = COUNT(*) FROM my_table WHERE x = 2 AND y = 2 AND z = 3;
 ?column? 
----------
 t
(1 row)

--
-- At this point, the user can not set x = 1 again!
--
UPDATE my_table SET x = 1 WHERE x = 2;
--
-- the first row still have the same values:
-- (2, 2, 3) instead of (1, 2, 3)
--
SELECT 0 = COUNT(*) FROM my_table WHERE x = 1 AND y = 2 AND z = 3;
 ?column? 
----------
 t
(1 row)

SELECT 1 = COUNT(*) FROM my_table WHERE x = 2 AND y = 2 AND z = 3;
 ?column? 
----------
 t
(1 row)

--
-- try to update all x to 1
--
UPDATE my_table SET X = 1;
--
-- we should not have any row with x == 1
--
SELECT 0 = COUNT(*) FROM my_table WHERE x = 1;
 ?column? 
----------
 t
(1 row)

--
-- remove the previous trigger
--
DROP TRIGGER validateBeforeUpdateMyTable ON my_table;
--
-------------------- VALIDATE BEFORE UPDATE ----------------------
------------------------------------------------------------------
--
------------------------------------------------------------------
----------------- VERIFY OLD TUPLE BEFORE UPDATE -----------------
--
--
-- create a new function to be called before UPDATE
-- It shows how to access the old tuple
--
CREATE OR REPLACE FUNCTION verifyOldBeforeUpdateMyTableFSharp() RETURNS TRIGGER AS $$
match (TD.tg_tuples.OLD, TD.tg_tuples.NEW) with
| Some OLD, Some _NEW ->
    let old_y_is_5 : bool = 5 = (OLD :> IDataRecord).GetInt32((OLD :> IDataRecord).GetOrdinal("y"))
    let new_x_is_3 : bool = 3 =  (_NEW :> IDataRecord).GetInt32((_NEW :> IDataRecord).GetOrdinal("x"))
    match (old_y_is_5,  new_x_is_3) with
    | (true, true) -> Some "SKIP"
    | _ -> None
| _ -> None
$$ LANGUAGE plfsharp;
--
CREATE TRIGGER verifyOldBeforeUpdateMyTable
BEFORE UPDATE ON my_table
FOR EACH ROW EXECUTE PROCEDURE verifyOldBeforeUpdateMyTableFSharp();
--
-- truncate both tables
--
TRUNCATE TABLE my_table;
--
\set entries_quantity 5
--
-- insert the data again
--
EXECUTE insert_my_values(:entries_quantity);
--
-- verify the second row
SELECT 1 = COUNT(*) FROM my_table WHERE x = 4 AND y = 5 AND z = 6;
 ?column? 
----------
 t
(1 row)

--
-- perform a valid update in the second row
UPDATE my_table SET x = 0 WHERE x = 4;
--
-- verify the second row
SELECT 1 = COUNT(*) FROM my_table WHERE x = 0 AND y = 5 AND z = 6;
 ?column? 
----------
 t
(1 row)

--
-- try to make an invalid update in the second row
UPDATE my_table SET x = 4 WHERE x = 0;
--
-- verify the second row again
SELECT 0 = COUNT(*) FROM my_table WHERE 4 = 0 AND y = 5 AND z = 6;
 ?column? 
----------
 t
(1 row)

--
DROP TRIGGER verifyOldBeforeUpdateMyTable ON my_table;
--
----------------- VERIFY OLD TUPLE BEFORE UPDATE -----------------
------------------------------------------------------------------
--
------------------------------------------------------------------
-------------------- REGISTER UPDATE EVENT -----------------------
--
-- create a new function to update the update_events table
-- when some change occurs in my_table
--
CREATE OR REPLACE FUNCTION registerEventAfterUpdateMyTableFSharp() RETURNS TRIGGER AS $$
SPI.Execute "INSERT INTO update_events VALUES (now()::timestamptz)" 1L |> ignore
None
$$ LANGUAGE plfsharp;
--
CREATE TRIGGER registerEventAfterUpdateMyTable
AFTER UPDATE ON my_table
FOR EACH ROW EXECUTE PROCEDURE registerEventAfterUpdateMyTableFSharp();
--
-- truncate both tables
--
TRUNCATE TABLE my_table;
TRUNCATE TABLE update_events;
--
\set entries_quantity 5
--
-- insert some data
--
EXECUTE insert_my_values(:entries_quantity);
--
-- the update_events table should be empty at this point
--
SELECT 0 = COUNT(*) FROM update_events;
 ?column? 
----------
 t
(1 row)

--
-- lets update the first row
--
UPDATE my_table SET x = 0 WHERE x = 1;
--
-- we should have a new entry in the update_events table
--
SELECT 1 = COUNT(*) FROM update_events;
 ?column? 
----------
 t
(1 row)

--
-- lets update the same row again
--
UPDATE my_table SET x = 1 WHERE x = 0;
--
-- we should have another entry
--
SELECT 2 = COUNT(*) FROM update_events;
 ?column? 
----------
 t
(1 row)

--
-- lets update two rows
--
UPDATE my_table SET x = x - 1 WHERE x < 7;
--
-- we should have two additional entries
--
SELECT 4 = COUNT(*) FROM update_events;
 ?column? 
----------
 t
(1 row)

--
-- remove the previous trigger
--
DROP TRIGGER registerEventAfterUpdateMyTable ON my_table;
--
-------------------- REGISTER UPDATE EVENT -----------------------
------------------------------------------------------------------
--
------------------------------------------------------------------
------------------- ACCESS TRIGGER VARIABLES ---------------------
--
-- This special function will be called before and after INSERT and UPDATES
CREATE OR REPLACE FUNCTION accessTriggerVariablesFSharp() RETURNS TRIGGER AS $$
let _name: bool = TD.tg_info.tg_name.Contains("accesstriggervariables")
let table_schema: bool = "public".Equals TD.tg_info.tg_table_schema
let table_name: bool = "my_table".Equals TD.tg_info.tg_table_name
let is_row: bool = "ROW".Equals TD.tg_info.tg_level
let is_before: bool = "BEFORE".Equals TD.tg_info.tg_when
let insertion: bool = "INSERT".Equals TD.tg_info.tg_event
let has_foo: bool =
    match TD.tg_args with
    | None -> false
    | Some args -> Array.contains "foo" args

match (_name && table_schema && table_name && is_row, has_foo, is_before) with
| false, _, _ -> Some "SKIP"
| _, true, _ -> Some "SKIP"
| true, _, true ->
    match TD.tg_tuples.NEW with
    | None -> None
    | Some _NEW ->
        match insertion, (_NEW :> IDataRecord).GetInt32((_NEW :> IDataRecord).GetOrdinal("x")) <> 0 with
        | true, true -> None
        | true, false -> Some "SKIP"
        | false, _ ->
            let x_pos = (_NEW :> IDataRecord).GetOrdinal("x")
            _NEW.SetInt32 x_pos ((_NEW :> IDataRecord).GetInt32(x_pos) + 100)
            Some "MODIFY"
| _, _, false ->
    SPI.Execute "INSERT INTO update_events VALUES (now()::timestamptz)" 1L |> ignore
    None
$$ LANGUAGE plfsharp;
--
CREATE TRIGGER accessTriggerVariablesBeforeInsertFSharp
BEFORE INSERT ON my_table
FOR EACH ROW EXECUTE PROCEDURE accessTriggerVariablesFSharp();
--
CREATE TRIGGER accessTriggerVariablesAfterInsertFSharp
AFTER INSERT ON my_table
FOR EACH ROW EXECUTE PROCEDURE accessTriggerVariablesFSharp();
--
CREATE TRIGGER accessTriggerVariablesBeforeUpdateFSharp
BEFORE UPDATE ON my_table
FOR EACH ROW EXECUTE PROCEDURE accessTriggerVariablesFSharp();
--
CREATE TRIGGER accessTriggerVariablesAfterUpdateFSharp
AFTER UPDATE ON my_table
FOR EACH ROW EXECUTE PROCEDURE accessTriggerVariablesFSharp();
--
TRUNCATE TABLE my_table;
TRUNCATE TABLE update_events;
--
-- test the simplest insertion of invalid entries
INSERT INTO my_table (x, y, z) VALUES (0, 2, 3), (0, 3, 2);
--
-- The insertion above must be discarded
--
SELECT 0 = COUNT(*) FROM my_table;
 ?column? 
----------
 t
(1 row)

--
-- Insert valid entries
INSERT INTO my_table (x, y, z) VALUES (1, 2, 3), (4, 5, 6);
--
SELECT 1 = COUNT(*) FROM my_table AS mt WHERE mt.x = 1 AND mt.y = 2 AND mt.z = 3.0;
 ?column? 
----------
 t
(1 row)

SELECT 1 = COUNT(*) FROM my_table AS mt WHERE mt.x = 4 AND mt.y = 5 AND mt.z = 6.0;
 ?column? 
----------
 t
(1 row)

--
-- We must have two update events
--
SELECT 2 = COUNT(*) FROM update_events;
 ?column? 
----------
 t
(1 row)

--
-- Test the update events
UPDATE my_table SET x = 0 WHERE x = 1;
--
-- The update event must increase X by 100, according the BEFORE UDPATE trigger
--
SELECT 1 = COUNT(*) FROM my_table WHERE x = 100;
 ?column? 
----------
 t
(1 row)

--
-- We have a new update event due to AFTER UPDATE trigger
--
SELECT 3 = COUNT(*) FROM update_events;
 ?column? 
----------
 t
(1 row)

--
DROP TRIGGER accessTriggerVariablesBeforeInsertFSharp ON my_table;
DROP TRIGGER accessTriggerVariablesAfterInsertFSharp ON my_table;
DROP TRIGGER accessTriggerVariablesBeforeUpdateFSharp ON my_table;
DROP TRIGGER accessTriggerVariablesAfterUpdateFSharp ON my_table;
--
-- Create a new trigger with args
--
CREATE TRIGGER accessTriggerVariablesWithoutFooBeforeInsert
BEFORE INSERT ON my_table
FOR EACH ROW EXECUTE PROCEDURE accessTriggerVariablesFSharp(2, "bar");
--
TRUNCATE TABLE my_table;
TRUNCATE TABLE update_events;
--
-- test the simplest insertion of invalid entries, 
--
INSERT INTO my_table (x, y, z) VALUES (0, 2, 3), (0, 3, 2);
--
-- The insertion above must be discarded
--
SELECT 0 = COUNT(*) FROM my_table;
 ?column? 
----------
 t
(1 row)

--
-- Test the insertion of valid entries, this time it should work
-- given that we do not have the foo parameter
--
INSERT INTO my_table (x, y, z) VALUES (1, 2, 3), (4, 5, 6);
--
-- The insertion above must be ok
--
SELECT 2 = COUNT(*) FROM my_table;
 ?column? 
----------
 t
(1 row)

--
-- remove the current trigger without "foo"
--
DROP TRIGGER accessTriggerVariablesWithoutFooBeforeInsert ON my_table;
--
TRUNCATE TABLE my_table;
TRUNCATE TABLE update_events;
--
-- create a new trigger with "foo"
CREATE TRIGGER accessTriggerVariablesWithFooBeforeInsert
BEFORE INSERT ON my_table
FOR EACH ROW EXECUTE PROCEDURE accessTriggerVariablesFSharp(2, "bar", "foo");
--
-- Test the insertion of valid entries, this time it should not work
-- because we have the foo parameter
--
INSERT INTO my_table (x, y, z) VALUES (1, 2, 3), (4, 5, 6);
--
-- The insertion above must be discarded
--
SELECT 0 = COUNT(*) FROM my_table;
 ?column? 
----------
 t
(1 row)

--
DROP TRIGGER accessTriggerVariablesWithFooBeforeInsert ON my_table;
--
------------------- ACCESS TRIGGER VARIABLES ---------------------
------------------------------------------------------------------
--
------------------------------------------------------------------
------------------- ACCESS TRIGGER RELATTS -----------------------
--
-- This function will be called before and after INSERT and UPDATES
CREATE OR REPLACE FUNCTION accessTriggerRelattsFSharp() RETURNS TRIGGER AS $$
match TD.tg_relatts with
| None -> None
| Some relatts ->
    match Array.contains "x" relatts with
    | true -> None
    | false -> Some "SKIP"
$$ LANGUAGE plfsharp;
--
CREATE TRIGGER accessTriggerRelattsFSharp
BEFORE INSERT ON my_table
FOR EACH ROW EXECUTE PROCEDURE accessTriggerRelattsFSharp();
--
TRUNCATE TABLE my_table;
TRUNCATE TABLE update_events;
--
\set entries_quantity 5
\set offset_x 0
\set offset_y 0
\set offset_z 0
--
-- test the simplest insertion of valid entries, 
--
EXECUTE insert_my_values(:entries_quantity);
--
-- verify if the 5 entries are present in the database
--
EXECUTE verify_entries(:entries_quantity, :offset_x, :offset_y, :offset_z);
 ?column? 
----------
 t
(1 row)

--
DROP TRIGGER accessTriggerRelattsFSharp ON my_table;
--
------------------- ACCESS TRIGGER RELATTS -----------------------
------------------------------------------------------------------
--
-- enable function body validation again
--
SET check_function_bodies = true;
--
DROP TABLE my_table CASCADE;
DROP TABLE update_events CASCADE;
